{
  "SolutionFile": "NetFrameworkExample",
  "ProjectFile": "NetFrameworkExample",
  "ProjectGuid": null,
  "Errors": [],
  "SourceFileAnalysisResults": [
    {
      "SourceFileName": "BundleConfig.cs",
      "SourceFilePath": "C:\\Users\\Administrator\\Documents\\workplace\\test-project\\NetFrameworkExample\\NetFrameworkExample\\NetFrameworkExample\\App_Start\\BundleConfig.cs",
      "ApiAnalysisResults": [
        {
          "CodeEntityDetails": {
            "CodeEntityType": "Namespace",
            "Name": "Add",
            "Namespace": "System.Web.Optimization",
            "Signature": "System.Web.Optimization.BundleCollection.Add(System.Web.Optimization.Bundle)",
            "OriginalDefinition": "System.Web.Optimization.BundleCollection.Add(System.Web.Optimization.Bundle)",
            "TextSpan": {
              "StartCharPosition": 13,
              "EndCharPosition": 58,
              "StartLinePosition": 11,
              "EndLinePosition": 12
            },
            "Package": {
              "PackageId": "System.Web.Optimization",
              "Version": "1.1.0",
              "PackageSourceType": "NUGET"
            }
          },
          "CompatibilityResults": {
            "netcoreapp3.1": {
              "Compatibility": "UNKNOWN",
              "CompatibleVersions": []
            }
          },
          "Recommendations": {
            "RecommendedActions": [
              {
                "CodeEntityDetails": null,
                "RecommendedActionType": "NoRecommendation",
                "Description": null,
                "TextSpan": null,
                "TargetCPU": null,
                "TextChanges": null
              }
            ]
          }
        },
        {
          "CodeEntityDetails": {
            "CodeEntityType": "Namespace",
            "Name": "Include",
            "Namespace": "System.Web.Optimization",
            "Signature": "System.Web.Optimization.Bundle.Include(string, params System.Web.Optimization.IItemTransform[])",
            "OriginalDefinition": "System.Web.Optimization.Bundle.Include(string, params System.Web.Optimization.IItemTransform[])",
            "TextSpan": {
              "StartCharPosition": 25,
              "EndCharPosition": 57,
              "StartLinePosition": 11,
              "EndLinePosition": 12
            },
            "Package": {
              "PackageId": "System.Web.Optimization",
              "Version": "1.1.0",
              "PackageSourceType": "NUGET"
            }
          },
          "CompatibilityResults": {
            "netcoreapp3.1": {
              "Compatibility": "UNKNOWN",
              "CompatibleVersions": []
            }
          },
          "Recommendations": {
            "RecommendedActions": [
              {
                "CodeEntityDetails": null,
                "RecommendedActionType": "NoRecommendation",
                "Description": null,
                "TextSpan": null,
                "TargetCPU": null,
                "TextChanges": null
              }
            ]
          }
        },
        {
          "CodeEntityDetails": {
            "CodeEntityType": "Namespace",
            "Name": "Add",
            "Namespace": "System.Web.Optimization",
            "Signature": "System.Web.Optimization.BundleCollection.Add(System.Web.Optimization.Bundle)",
            "OriginalDefinition": "System.Web.Optimization.BundleCollection.Add(System.Web.Optimization.Bundle)",
            "TextSpan": {
              "StartCharPosition": 13,
              "EndCharPosition": 55,
              "StartLinePosition": 14,
              "EndLinePosition": 15
            },
            "Package": {
              "PackageId": "System.Web.Optimization",
              "Version": "1.1.0",
              "PackageSourceType": "NUGET"
            }
          },
          "CompatibilityResults": {
            "netcoreapp3.1": {
              "Compatibility": "UNKNOWN",
              "CompatibleVersions": []
            }
          },
          "Recommendations": {
            "RecommendedActions": [
              {
                "CodeEntityDetails": null,
                "RecommendedActionType": "NoRecommendation",
                "Description": null,
                "TextSpan": null,
                "TargetCPU": null,
                "TextChanges": null
              }
            ]
          }
        },
        {
          "CodeEntityDetails": {
            "CodeEntityType": "Namespace",
            "Name": "Include",
            "Namespace": "System.Web.Optimization",
            "Signature": "System.Web.Optimization.Bundle.Include(string, params System.Web.Optimization.IItemTransform[])",
            "OriginalDefinition": "System.Web.Optimization.Bundle.Include(string, params System.Web.Optimization.IItemTransform[])",
            "TextSpan": {
              "StartCharPosition": 25,
              "EndCharPosition": 54,
              "StartLinePosition": 14,
              "EndLinePosition": 15
            },
            "Package": {
              "PackageId": "System.Web.Optimization",
              "Version": "1.1.0",
              "PackageSourceType": "NUGET"
            }
          },
          "CompatibilityResults": {
            "netcoreapp3.1": {
              "Compatibility": "UNKNOWN",
              "CompatibleVersions": []
            }
          },
          "Recommendations": {
            "RecommendedActions": [
              {
                "CodeEntityDetails": null,
                "RecommendedActionType": "NoRecommendation",
                "Description": null,
                "TextSpan": null,
                "TargetCPU": null,
                "TextChanges": null
              }
            ]
          }
        },
        {
          "CodeEntityDetails": {
            "CodeEntityType": "Namespace",
            "Name": "Add",
            "Namespace": "System.Web.Optimization",
            "Signature": "System.Web.Optimization.BundleCollection.Add(System.Web.Optimization.Bundle)",
            "OriginalDefinition": "System.Web.Optimization.BundleCollection.Add(System.Web.Optimization.Bundle)",
            "TextSpan": {
              "StartCharPosition": 13,
              "EndCharPosition": 50,
              "StartLinePosition": 19,
              "EndLinePosition": 20
            },
            "Package": {
              "PackageId": "System.Web.Optimization",
              "Version": "1.1.0",
              "PackageSourceType": "NUGET"
            }
          },
          "CompatibilityResults": {
            "netcoreapp3.1": {
              "Compatibility": "UNKNOWN",
              "CompatibleVersions": []
            }
          },
          "Recommendations": {
            "RecommendedActions": [
              {
                "CodeEntityDetails": null,
                "RecommendedActionType": "NoRecommendation",
                "Description": null,
                "TextSpan": null,
                "TargetCPU": null,
                "TextChanges": null
              }
            ]
          }
        },
        {
          "CodeEntityDetails": {
            "CodeEntityType": "Namespace",
            "Name": "Include",
            "Namespace": "System.Web.Optimization",
            "Signature": "System.Web.Optimization.Bundle.Include(string, params System.Web.Optimization.IItemTransform[])",
            "OriginalDefinition": "System.Web.Optimization.Bundle.Include(string, params System.Web.Optimization.IItemTransform[])",
            "TextSpan": {
              "StartCharPosition": 25,
              "EndCharPosition": 49,
              "StartLinePosition": 19,
              "EndLinePosition": 20
            },
            "Package": {
              "PackageId": "System.Web.Optimization",
              "Version": "1.1.0",
              "PackageSourceType": "NUGET"
            }
          },
          "CompatibilityResults": {
            "netcoreapp3.1": {
              "Compatibility": "UNKNOWN",
              "CompatibleVersions": []
            }
          },
          "Recommendations": {
            "RecommendedActions": [
              {
                "CodeEntityDetails": null,
                "RecommendedActionType": "NoRecommendation",
                "Description": null,
                "TextSpan": null,
                "TargetCPU": null,
                "TextChanges": null
              }
            ]
          }
        },
        {
          "CodeEntityDetails": {
            "CodeEntityType": "Namespace",
            "Name": "Add",
            "Namespace": "System.Web.Optimization",
            "Signature": "System.Web.Optimization.BundleCollection.Add(System.Web.Optimization.Bundle)",
            "OriginalDefinition": "System.Web.Optimization.BundleCollection.Add(System.Web.Optimization.Bundle)",
            "TextSpan": {
              "StartCharPosition": 13,
              "EndCharPosition": 49,
              "StartLinePosition": 22,
              "EndLinePosition": 23
            },
            "Package": {
              "PackageId": "System.Web.Optimization",
              "Version": "1.1.0",
              "PackageSourceType": "NUGET"
            }
          },
          "CompatibilityResults": {
            "netcoreapp3.1": {
              "Compatibility": "UNKNOWN",
              "CompatibleVersions": []
            }
          },
          "Recommendations": {
            "RecommendedActions": [
              {
                "CodeEntityDetails": null,
                "RecommendedActionType": "NoRecommendation",
                "Description": null,
                "TextSpan": null,
                "TargetCPU": null,
                "TextChanges": null
              }
            ]
          }
        },
        {
          "CodeEntityDetails": {
            "CodeEntityType": "Namespace",
            "Name": "Include",
            "Namespace": "System.Web.Optimization",